{
  "$schema": "https://json-schema.org/draft/2020-12/schema",
  "$id": "sign.schema.json",
  "title": "The extracted structure of a parking sign",
  "description": "The contract between the vision model and the deterministic code. The model fills in ONLY these fields: a closed list, with additionalProperties forbidden everywhere. Anything the model would like to say beyond the schema goes into notes and does not enter the computation.",
  "type": "object",
  "additionalProperties": false,
  "required": [
    "schema_version",
    "main_sign",
    "panels",
    "panel_count",
    "boundaries"
  ],
  "properties": {
    "schema_version": {
      "const": 1
    },
    "main_sign": {
      "description": "The top panel of the stack. NOT part of panels: in a probe the model duplicated the P as a first plate, so validation must discard a panel whose entire content is the main sign's pictogram.",
      "type": "object",
      "additionalProperties": false,
      "required": [
        "type",
        "background_color",
        "form",
        "legibility"
      ],
      "properties": {
        "type": {
          "description": "wayfinding_* permit no parking at all - they are direction signs, and must not be confused with a sign that permits parking.",
          "enum": [
            "parking",
            "prohibition_parking",
            "prohibition_stopping",
            "wayfinding_parking_house",
            "wayfinding_park_and_ride",
            "unknown"
          ]
        },
        "background_color": {
          "$ref": "#/$defs/color"
        },
        "form": {
          "description": "zone marks the start of a zone (a yellow square with a round sign inside). The rule reads the same as on an ordinary sign; the product does not compute how far the zone extends.",
          "enum": [
            "regular",
            "zone",
            "unknown"
          ]
        },
        "legibility": {
          "$ref": "#/$defs/legibility"
        }
      }
    },
    "panels": {
      "description": "The panels BELOW the main sign, strictly in top-to-bottom order. The order matters: the rule depends on it.",
      "type": "array",
      "items": {
        "$ref": "#/$defs/panel"
      }
    },
    "panel_count": {
      "description": "The number of panels below the main sign. Deliberately duplicates the length of panels: a disagreement signals that the model lost a boundary, and it cannot be derived from the list itself.",
      "type": "integer",
      "minimum": 0
    },
    "boundaries": {
      "description": "About the boundaries between panels. The model STATES its opinion here, but the code does not take it on trust: on photograph 013 two plates were merged into one with certain = true. Uncertainty is assembled by code from independent signals.",
      "type": "object",
      "additionalProperties": false,
      "required": [
        "certain"
      ],
      "properties": {
        "certain": {
          "type": "boolean"
        },
        "doubt": {
          "description": "Between which adjacent panels the boundary is in doubt. Panel indices.",
          "type": "array",
          "items": {
            "type": "integer",
            "minimum": 1
          }
        }
      }
    },
    "notes": {
      "description": "Free text from the model. Does NOT enter the engine or the confidence formula: prose is not checked by code. It exists so the model has somewhere to put an observation for which there is no field, and so such observations stay visible when errors are examined.",
      "type": [
        "string",
        "null"
      ],
      "maxLength": 1000
    },
    "model_confidence": {
      "description": "The model's own estimate. One of the inputs to the confidence formula, and not the deciding one.",
      "type": [
        "number",
        "null"
      ],
      "minimum": 0,
      "maximum": 1
    },
    "another_post_in_frame": {
      "description": "True when the photograph shows another sign post, its sign facing the camera, besides the one read. The back of a sign does not count. Only one post is read; this says the answer does not cover the other.",
      "type": "boolean"
    }
  },
  "$defs": {
    "color": {
      "description": "Background colour is an extracted field, not decoration. In Sweden warning and prohibition signs are yellow, so a yellow panel means a prohibition or a restriction; blue and white sit under permitting signs.",
      "enum": [
        "blue",
        "yellow",
        "white",
        "green",
        "other",
        "unreadable"
      ]
    },
    "legibility": {
      "description": "Legibility as a schema field rather than a phrase in notes: the confidence formula works with fields, not with prose.",
      "type": "object",
      "additionalProperties": false,
      "required": [
        "readable"
      ],
      "properties": {
        "readable": {
          "type": "boolean"
        },
        "obstructions": {
          "type": "array",
          "items": {
            "enum": [
              "sticker",
              "dirt",
              "snow",
              "glare",
              "shadow",
              "damage",
              "cropped",
              "blur",
              "distance",
              "angle"
            ]
          }
        }
      }
    },
    "panel": {
      "type": "object",
      "additionalProperties": false,
      "required": [
        "index",
        "kind",
        "lines",
        "background_color",
        "legibility",
        "parsed"
      ],
      "properties": {
        "index": {
          "description": "Position from the top, starting at 1.",
          "type": "integer",
          "minimum": 1
        },
        "kind": {
          "description": "What kind of panel this is. `sign_plate` - a plate that states a rule: only these reach the engine. `operator_plate` - a plate carrying an operator's name and telephone: in form a lawful additional plate, but it states no rule. `info_board` - a payment board with a zone code and app advertising, which is not a road sign at all. The last two are marked rather than discarded: they are visible in the photograph, and passing over them silently looks like a loss. They do not reach the user's answer. `other_sign` - a road sign on the same post that is not part of the parking stack (a priority road, a speed limit, a speed bump): shown, not interpreted, except where it changes whether parking is allowed at all.",
          "enum": [
            "sign_plate",
            "operator_plate",
            "info_board",
            "other_sign"
          ]
        },
        "lines": {
          "description": "The text verbatim, line by line, in Swedish, with brackets and hyphens as on the sign. An empty array if the panel carries only a pictogram.",
          "type": "array",
          "items": {
            "type": "string"
          }
        },
        "background_color": {
          "$ref": "#/$defs/color"
        },
        "legibility": {
          "$ref": "#/$defs/legibility"
        },
        "parsed": {
          "$ref": "#/$defs/parsed"
        }
      }
    },
    "parsed": {
      "description": "The second layer: what the model assigned to known categories. The fields are independent and all optional - one panel usually carries one or two. Meaning (whether this is a gate, a note or a rule) is assigned by CODE from the reference, not by the model.",
      "type": "object",
      "additionalProperties": false,
      "properties": {
        "duration_limit": {
          "description": "The maximum length of a single stay: `2 tim`, `30 min`, `7 dygn`. A `dygn` is a whole day of 24 hours, and goes in as `days` - not converted into hours.",
          "type": "object",
          "additionalProperties": false,
          "required": [
            "amount",
            "unit"
          ],
          "properties": {
            "amount": {
              "type": "number",
              "exclusiveMinimum": 0
            },
            "unit": {
              "enum": [
                "minutes",
                "hours",
                "days"
              ]
            }
          }
        },
        "time_windows": {
          "description": "Windows on the panel. There may be several with different day classes: `8-18` and `(8-15)` on one plate are two windows.",
          "type": "array",
          "items": {
            "type": "object",
            "additionalProperties": false,
            "required": [
              "from",
              "to",
              "day_class"
            ],
            "properties": {
              "from": {
                "$ref": "#/$defs/clock"
              },
              "to": {
                "$ref": "#/$defs/clock"
              },
              "day_class": {
                "description": "unspecified - no days are stated; all_days - the explicit token `alla dagar`; weekday/eve/red - the class given by how the number is set; named_weekday - a weekday is named. unspecified and all_days are DIFFERENT values: computing the complement rests on that difference.",
                "enum": [
                  "unspecified",
                  "all_days",
                  "weekday",
                  "eve",
                  "red",
                  "named_weekday"
                ]
              },
              "named_weekday": {
                "description": "Filled in only when day_class = named_weekday. This is a LITERAL: the holiday calendar does not apply to it - a `Tisdag 18-24` prohibition holds on a Tuesday that is a holiday.",
                "enum": [
                  "monday",
                  "tuesday",
                  "wednesday",
                  "thursday",
                  "friday",
                  "saturday",
                  "sunday"
                ]
              },
              "week_parity": {
                "description": "The parity of the ISO week number: `jamna veckor` even, `udda veckor` odd. This is how street cleaning is marked in Sweden: the prohibition applies every other week rather than every week. Without this field the product treats the prohibition as always in force and overstates strictness; worse, on a permitting window it would overstate permission.",
                "enum": [
                  "even",
                  "odd"
                ]
              },
              "dates": {
                "description": "Dates bounding the window. `mode: only` - the window applies ONLY within these ranges; `mode: except` - it applies always EXCEPT within them. A range is given as a day and month without a year (`MM-DD`) and may straddle the end of the year: `11-01` ... `05-15` is winter. A single day is written as a range whose start equals its end.\n\nThis is how the plates are written: `Galler ej 1 juli - 31 juli` is `except` with a range across July, `1 nov-15 maj` is `only` with a winter range, and `Galler ej 15/6 15/8` is `except` with two single-day ranges.",
                "type": "object",
                "additionalProperties": false,
                "required": [
                  "mode",
                  "ranges"
                ],
                "properties": {
                  "mode": {
                    "enum": [
                      "only",
                      "except"
                    ]
                  },
                  "ranges": {
                    "type": "array",
                    "minItems": 1,
                    "items": {
                      "type": "object",
                      "additionalProperties": false,
                      "required": [
                        "from",
                        "to"
                      ],
                      "properties": {
                        "from": {
                          "type": "string",
                          "pattern": "^[01][0-9]-[0-3][0-9]$"
                        },
                        "to": {
                          "type": "string",
                          "pattern": "^[01][0-9]-[0-3][0-9]$"
                        }
                      }
                    }
                  }
                }
              },
              "day_of_month": {
                "description": "The window applies only on this day of every month: `1:a varje månad` is 1. The other days of the month are not covered.",
                "type": "integer",
                "minimum": 1,
                "maximum": 31
              },
              "nth_of_month": {
                "description": "Together with `named_weekday`: the window applies only on that weekday's Nth occurrence in the month. `3:e tisdagen` is 3 with `tuesday`.",
                "type": "integer",
                "minimum": 1,
                "maximum": 5
              }
            }
          }
        },
        "fee": {
          "description": "A fee is stated on the panel (`Avgift`).",
          "type": "boolean"
        },
        "payment_method": {
          "description": "What must be **shown** for the stay to be lawful: a ticket or a parking disc. This is a condition of parking, not a means of payment. The payment channel (app, SMS, machine) is out of scope: it answers no part of whether one may park here and on what terms.",
          "enum": [
            "ticket",
            "parking_disc"
          ]
        },
        "permit_required": {
          "description": "A special permit is required (`Sarskilt P-tillstand erfordras`).",
          "type": "boolean"
        },
        "scope_shift": {
          "description": "A scope-shift token: `Ovrig tid` and the like. It means that what follows refers to the complement of the declared window. An unrecognised shift token is grounds for refusal: without it there is no telling what time the following lines refer to.",
          "enum": [
            "remaining_time"
          ]
        },
        "eligibility": {
          "description": "Who the sign designates the spaces for. This is a CAPTION to the regime, not a check: the product does not know who is standing at the sign, and never decides whether the reader belongs to the category.",
          "enum": [
            "residents",
            "visitors",
            "rented",
            "permit_holders",
            "disabled_permit",
            "custom"
          ]
        },
        "vehicle_class": {
          "description": "Appears only where the sign NARROWS the range. The absence of the field means the range is not narrowed: a lone P permits parking for every registered motor vehicle, and a car must not be substituted here.",
          "enum": [
            "motorcycle",
            "car_only",
            "electric",
            "truck",
            "bus",
            "bicycle",
            "taxi"
          ]
        },
        "arrow": {
          "description": "The extent arrow: which stretch relative to the sign the instruction above it applies to. There is no separate boundary meaning - an arrow pointing down means the stretch ends at the sign.",
          "enum": [
            "up",
            "down",
            "both_vertical",
            "left",
            "right",
            "both_horizontal"
          ]
        },
        "place_count": {
          "description": "A number of spaces (`2 platser`). This is a count, not a duration: its nearest neighbour in writing is `2 tim`.",
          "type": "integer",
          "minimum": 1
        },
        "stretch_metres": {
          "description": "The stretch over which the sign applies (`0-25 m`).",
          "type": "object",
          "additionalProperties": false,
          "required": [
            "from",
            "to"
          ],
          "properties": {
            "from": {
              "type": "number",
              "minimum": 0
            },
            "to": {
              "type": "number",
              "minimum": 0
            }
          }
        },
        "placement": {
          "description": "A requirement about how to stand: only within a marked bay, or the arrangement shown by a pictogram.",
          "enum": [
            "marked_bay_only",
            "as_shown"
          ]
        },
        "prohibition": {
          "description": "A prohibition symbol on the panel. Within its own window a prohibition OVERRIDES permission rather than being weighed equally with it.",
          "type": "boolean"
        },
        "pictogram": {
          "description": "The pictogram on the panel, if there is one. A panel may carry an instruction with no text at all.",
          "enum": [
            "parking",
            "wheelchair",
            "motorcycle",
            "car",
            "electric_car",
            "truck",
            "bus",
            "prohibition",
            "parking_disc",
            "arrow",
            "payment",
            "bicycle",
            "other"
          ]
        },
        "operator": {
          "description": "An operator's information plate: name and telephone. States no rule, does not enter the engine, and does not lower the confidence.",
          "type": "object",
          "additionalProperties": false,
          "properties": {
            "name": {
              "type": "string"
            },
            "phone": {
              "type": "string"
            },
            "org_number": {
              "type": "string"
            }
          }
        },
        "tariff_code": {
          "description": "A tariff number (`Taxa 13`). Set by the municipality and does not affect the reading: it is shown verbatim and does not lower the confidence.",
          "type": "string"
        },
        "area_code": {
          "description": "The zone code for paying through an app (`Omradeskod 31370`).",
          "type": "string"
        },
        "uninterpreted": {
          "description": "Lines the model read but assigned to no category. Shown to the user verbatim and not part of the computation.",
          "type": "array",
          "items": {
            "type": "string"
          }
        },
        "permits_parking": {
          "description": "The plate itself shows a parking sign (`P Avgift`, `P Forhyrda platser`) and thereby restores permission within its own scope. Needed where the main sign is a prohibition: photograph 019 carries a 7-18 prohibition, and `ovrig tid` permits parking again for a fee. Without this field the prohibition would extend to the complement as well.",
          "type": "boolean"
        },
        "road_sign": {
          "description": "Which road sign an `other_sign` panel is. A priority road matters: on one, parking needs a sign that permits it.",
          "enum": [
            "priority_road",
            "speed_limit",
            "speed_bump",
            "pedestrian_crossing",
            "other"
          ]
        },
        "street_side": {
          "description": "The plate limits its rule to one side of the street by house number: `even_numbers` or `odd_numbers`. This is about the STREET, not about weeks - even weeks are `week_parity`, and the two must never be swapped.",
          "enum": [
            "even_numbers",
            "odd_numbers"
          ]
        },
        "unrecognised_slot": {
          "description": "For a plate whose words are legible but fit no field: which question they answer - who may park, when, how long, at what price, or where. The words themselves go in `uninterpreted` as usual.",
          "enum": [
            "who",
            "when",
            "how_long",
            "how_much",
            "where"
          ]
        }
      }
    },
    "clock": {
      "description": "An hour as HH:MM, 24-hour. The model normalises `7-17` and `07-17` alike.",
      "type": "string",
      "pattern": "^([01][0-9]|2[0-4]):[0-5][0-9]$"
    }
  }
}
