{
  "schema_version": 1,
  "main_sign": {
    "type": "parking",
    "background_color": "blue",
    "form": "regular",
    "legibility": {
      "readable": true
    }
  },
  "panels": [
    {
      "kind": "sign_plate",
      "lines": [],
      "background_color": "blue",
      "legibility": {
        "readable": true
      },
      "parsed": {
        "eligibility": "disabled_permit",
        "pictogram": "wheelchair"
      },
      "index": 1
    },
    {
      "kind": "sign_plate",
      "lines": [],
      "background_color": "white",
      "legibility": {
        "readable": true
      },
      "parsed": {
        "arrow": "right",
        "pictogram": "arrow"
      },
      "index": 2
    }
  ],
  "panel_count": 2,
  "boundaries": {
    "certain": true
  }
}
