{
  "schema_version": 1,
  "main_sign": {
    "type": "parking",
    "background_color": "blue",
    "form": "regular",
    "legibility": {
      "readable": true,
      "obstructions": [
        "sticker"
      ]
    }
  },
  "panels": [
    {
      "kind": "sign_plate",
      "lines": [
        "Förhyrda platser"
      ],
      "background_color": "blue",
      "legibility": {
        "readable": true,
        "obstructions": [
          "sticker"
        ]
      },
      "parsed": {
        "eligibility": "rented"
      },
      "index": 1
    }
  ],
  "panel_count": 1,
  "boundaries": {
    "certain": true
  }
}
