{
  "schema_version": 1,
  "main_sign": {
    "type": "parking",
    "background_color": "blue",
    "form": "regular",
    "legibility": {
      "readable": true
    }
  },
  "panels": [
    {
      "kind": "sign_plate",
      "lines": [
        "Avgift",
        "7-19",
        "(11-17)",
        "Taxa 4"
      ],
      "background_color": "blue",
      "legibility": {
        "readable": true
      },
      "parsed": {
        "fee": true,
        "tariff_code": "Taxa 4",
        "time_windows": [
          {
            "from": "07:00",
            "to": "19:00",
            "day_class": "weekday"
          },
          {
            "from": "11:00",
            "to": "17:00",
            "day_class": "eve"
          }
        ]
      },
      "index": 1
    },
    {
      "kind": "sign_plate",
      "lines": [
        "Fred",
        "9-14"
      ],
      "background_color": "yellow",
      "legibility": {
        "readable": true
      },
      "parsed": {
        "prohibition": true,
        "time_windows": [
          {
            "from": "09:00",
            "to": "14:00",
            "day_class": "named_weekday",
            "named_weekday": "friday"
          }
        ]
      },
      "index": 2
    },
    {
      "kind": "sign_plate",
      "lines": [
        "Boende",
        "StE"
      ],
      "background_color": "white",
      "legibility": {
        "readable": true
      },
      "parsed": {
        "eligibility": "residents"
      },
      "index": 3
    },
    {
      "kind": "info_board",
      "lines": [
        "Betala digitalt"
      ],
      "background_color": "white",
      "legibility": {
        "readable": true
      },
      "parsed": {},
      "index": 4
    }
  ],
  "panel_count": 4,
  "boundaries": {
    "certain": true
  }
}
