{
  "schema_version": 1,
  "main_sign": {
    "type": "parking",
    "background_color": "blue",
    "form": "regular",
    "legibility": {
      "readable": true
    }
  },
  "panels": [
    {
      "kind": "sign_plate",
      "lines": [
        "Avgift"
      ],
      "background_color": "blue",
      "legibility": {
        "readable": true
      },
      "parsed": {
        "fee": true
      },
      "index": 1
    },
    {
      "kind": "sign_plate",
      "lines": [
        "Klass I",
        "22-06",
        "(22-06)",
        "22-06"
      ],
      "background_color": "blue",
      "legibility": {
        "readable": true
      },
      "parsed": {
        "vehicle_class": "car_only",
        "pictogram": "car",
        "time_windows": [
          {
            "from": "22:00",
            "to": "06:00",
            "day_class": "weekday"
          },
          {
            "from": "22:00",
            "to": "06:00",
            "day_class": "eve"
          },
          {
            "from": "22:00",
            "to": "06:00",
            "day_class": "red"
          }
        ]
      },
      "index": 2
    },
    {
      "kind": "sign_plate",
      "lines": [
        "Utanför",
        "markerad",
        "plats"
      ],
      "background_color": "yellow",
      "legibility": {
        "readable": true
      },
      "parsed": {
        "prohibition": true,
        "placement": "marked_bay_only"
      },
      "index": 3
    },
    {
      "kind": "operator_plate",
      "lines": [
        "SECURITAS",
        "0771-767000"
      ],
      "background_color": "blue",
      "legibility": {
        "readable": true
      },
      "parsed": {},
      "index": 4
    },
    {
      "kind": "info_board",
      "lines": [
        "MOBILL",
        "801"
      ],
      "background_color": "white",
      "legibility": {
        "readable": true
      },
      "parsed": {},
      "index": 5
    },
    {
      "kind": "info_board",
      "lines": [
        "epark",
        "801",
        "Parkster"
      ],
      "background_color": "white",
      "legibility": {
        "readable": true
      },
      "parsed": {},
      "index": 6
    }
  ],
  "panel_count": 6,
  "boundaries": {
    "certain": true
  }
}
