{
  "schema_version": 1,
  "main_sign": {
    "type": "parking",
    "background_color": "blue",
    "form": "regular",
    "legibility": {
      "readable": true
    }
  },
  "panels": [
    {
      "kind": "sign_plate",
      "lines": [
        "3 tim"
      ],
      "background_color": "blue",
      "legibility": {
        "readable": true
      },
      "parsed": {
        "duration_limit": {
          "amount": 3,
          "unit": "hours"
        },
        "payment_method": "parking_disc",
        "pictogram": "parking_disc"
      },
      "index": 1
    },
    {
      "kind": "sign_plate",
      "lines": [],
      "background_color": "blue",
      "legibility": {
        "readable": true
      },
      "parsed": {
        "placement": "as_shown"
      },
      "index": 2
    },
    {
      "kind": "sign_plate",
      "lines": [],
      "background_color": "white",
      "legibility": {
        "readable": true
      },
      "parsed": {
        "arrow": "right",
        "pictogram": "arrow"
      },
      "index": 3
    }
  ],
  "panel_count": 3,
  "boundaries": {
    "certain": true
  }
}
