{
  "schema_version": 1,
  "main_sign": {
    "type": "parking",
    "background_color": "blue",
    "form": "regular",
    "legibility": {
      "readable": true
    }
  },
  "panels": [
    {
      "kind": "sign_plate",
      "lines": [
        "Förhyrda",
        "platser"
      ],
      "background_color": "blue",
      "legibility": {
        "readable": true
      },
      "parsed": {
        "eligibility": "rented"
      },
      "index": 1
    },
    {
      "kind": "sign_plate",
      "lines": [
        "2 platser"
      ],
      "background_color": "blue",
      "legibility": {
        "readable": true
      },
      "parsed": {
        "place_count": 2
      },
      "index": 2
    },
    {
      "kind": "sign_plate",
      "lines": [],
      "background_color": "white",
      "legibility": {
        "readable": true
      },
      "parsed": {
        "arrow": "both_horizontal",
        "pictogram": "arrow"
      },
      "index": 3
    }
  ],
  "panel_count": 3,
  "boundaries": {
    "certain": true
  }
}
