{
  "schema_version": 1,
  "main_sign": {
    "type": "parking",
    "background_color": "blue",
    "form": "regular",
    "legibility": {
      "readable": true
    }
  },
  "panels": [
    {
      "kind": "sign_plate",
      "lines": [
        "Giltigt",
        "P-tillstånd",
        "erfordras",
        "06-16"
      ],
      "background_color": "blue",
      "legibility": {
        "readable": true
      },
      "parsed": {
        "permit_required": true,
        "eligibility": "permit_holders",
        "time_windows": [
          {
            "from": "06:00",
            "to": "16:00",
            "day_class": "weekday"
          }
        ]
      },
      "index": 1
    },
    {
      "kind": "sign_plate",
      "lines": [
        "3 tim",
        "16-06",
        "(00-24)",
        "00-24"
      ],
      "background_color": "blue",
      "legibility": {
        "readable": true
      },
      "parsed": {
        "payment_method": "parking_disc",
        "duration_limit": {
          "amount": 3,
          "unit": "hours"
        },
        "time_windows": [
          {
            "from": "16:00",
            "to": "06:00",
            "day_class": "weekday"
          },
          {
            "from": "00:00",
            "to": "24:00",
            "day_class": "eve"
          },
          {
            "from": "00:00",
            "to": "24:00",
            "day_class": "red"
          }
        ]
      },
      "index": 2
    }
  ],
  "panel_count": 2,
  "boundaries": {
    "certain": true
  }
}
