{
  "schema_version": 1,
  "main_sign": {
    "type": "parking",
    "background_color": "blue",
    "form": "regular",
    "legibility": {
      "readable": true,
      "obstructions": [
        "glare",
        "distance"
      ]
    }
  },
  "panels": [
    {
      "kind": "sign_plate",
      "lines": [],
      "background_color": "blue",
      "legibility": {
        "readable": false,
        "obstructions": [
          "glare",
          "distance"
        ]
      },
      "parsed": {},
      "index": 1
    },
    {
      "kind": "sign_plate",
      "lines": [],
      "background_color": "blue",
      "legibility": {
        "readable": false,
        "obstructions": [
          "glare",
          "distance"
        ]
      },
      "parsed": {},
      "index": 2
    },
    {
      "kind": "sign_plate",
      "lines": [],
      "background_color": "white",
      "legibility": {
        "readable": true,
        "obstructions": [
          "glare",
          "distance"
        ]
      },
      "parsed": {
        "arrow": "left",
        "pictogram": "arrow"
      },
      "index": 3
    }
  ],
  "panel_count": 3,
  "boundaries": {
    "certain": true
  }
}
