{
  "schema_version": 1,
  "main_sign": {
    "type": "parking",
    "background_color": "blue",
    "form": "regular",
    "legibility": {
      "readable": true
    }
  },
  "panels": [
    {
      "kind": "sign_plate",
      "lines": [
        "Avgift"
      ],
      "background_color": "blue",
      "legibility": {
        "readable": true
      },
      "parsed": {
        "fee": true
      },
      "index": 1
    },
    {
      "kind": "sign_plate",
      "lines": [
        "Tisdag",
        "12-15",
        "1 nov-15 maj"
      ],
      "background_color": "yellow",
      "legibility": {
        "readable": true
      },
      "parsed": {
        "prohibition": true,
        "time_windows": [
          {
            "from": "12:00",
            "to": "15:00",
            "day_class": "named_weekday",
            "named_weekday": "tuesday",
            "dates": {
              "mode": "only",
              "ranges": [
                {
                  "from": "11-01",
                  "to": "05-15"
                }
              ]
            }
          }
        ]
      },
      "index": 2
    },
    {
      "kind": "sign_plate",
      "lines": [
        "Zon C"
      ],
      "background_color": "white",
      "legibility": {
        "readable": true
      },
      "parsed": {
        "tariff_code": "Zon C"
      },
      "index": 3
    },
    {
      "kind": "sign_plate",
      "lines": [
        "Boende",
        "Storskogen"
      ],
      "background_color": "white",
      "legibility": {
        "readable": true
      },
      "parsed": {
        "eligibility": "residents"
      },
      "index": 4
    },
    {
      "kind": "info_board",
      "lines": [
        "8401"
      ],
      "background_color": "white",
      "legibility": {
        "readable": true
      },
      "parsed": {
        "area_code": "8401"
      },
      "index": 5
    }
  ],
  "panel_count": 5,
  "boundaries": {
    "certain": true
  }
}
