{
  "schema_version": 1,
  "main_sign": {
    "type": "prohibition_parking",
    "background_color": "yellow",
    "form": "regular",
    "legibility": {
      "readable": true
    }
  },
  "panels": [
    {
      "kind": "sign_plate",
      "lines": [
        "7-19"
      ],
      "background_color": "yellow",
      "legibility": {
        "readable": true
      },
      "parsed": {
        "time_windows": [
          {
            "from": "07:00",
            "to": "19:00",
            "day_class": "weekday"
          }
        ]
      },
      "index": 1
    },
    {
      "kind": "sign_plate",
      "lines": [
        "0-10 m"
      ],
      "background_color": "yellow",
      "legibility": {
        "readable": true
      },
      "parsed": {
        "stretch_metres": {
          "from": 0,
          "to": 10
        }
      },
      "index": 2
    },
    {
      "kind": "sign_plate",
      "lines": [
        "Tisd",
        "0-6"
      ],
      "background_color": "yellow",
      "legibility": {
        "readable": true
      },
      "parsed": {
        "prohibition": true,
        "time_windows": [
          {
            "from": "00:00",
            "to": "06:00",
            "day_class": "named_weekday",
            "named_weekday": "tuesday"
          }
        ]
      },
      "index": 3
    },
    {
      "kind": "sign_plate",
      "lines": [
        "Övrig tid",
        "Avgift",
        "(11-17)",
        "Taxa 3"
      ],
      "background_color": "blue",
      "legibility": {
        "readable": true
      },
      "parsed": {
        "permits_parking": true,
        "pictogram": "parking",
        "scope_shift": "remaining_time",
        "fee": true,
        "tariff_code": "Taxa 3",
        "time_windows": [
          {
            "from": "11:00",
            "to": "17:00",
            "day_class": "eve"
          }
        ]
      },
      "index": 4
    }
  ],
  "panel_count": 4,
  "boundaries": {
    "certain": true
  }
}
