{
  "schema_version": 1,
  "main_sign": {
    "type": "parking",
    "background_color": "blue",
    "form": "regular",
    "legibility": {
      "readable": true
    }
  },
  "panels": [
    {
      "kind": "sign_plate",
      "lines": [
        "REGIONSERVICE"
      ],
      "background_color": "blue",
      "legibility": {
        "readable": true
      },
      "parsed": {
        "eligibility": "custom"
      },
      "index": 1
    },
    {
      "kind": "sign_plate",
      "lines": [
        "1 plats"
      ],
      "background_color": "blue",
      "legibility": {
        "readable": true
      },
      "parsed": {
        "place_count": 1
      },
      "index": 2
    }
  ],
  "panel_count": 2,
  "boundaries": {
    "certain": true
  }
}
