{
  "schema_version": 1,
  "main_sign": {
    "type": "parking",
    "background_color": "blue",
    "form": "regular",
    "legibility": {
      "readable": true
    }
  },
  "panels": [
    {
      "kind": "sign_plate",
      "lines": [
        "7 dygn"
      ],
      "background_color": "blue",
      "legibility": {
        "readable": true
      },
      "parsed": {
        "duration_limit": {
          "amount": 7,
          "unit": "days"
        }
      },
      "index": 1
    },
    {
      "kind": "sign_plate",
      "lines": [
        "Torsd",
        "8-16",
        "1/11-15/5"
      ],
      "background_color": "yellow",
      "legibility": {
        "readable": true
      },
      "parsed": {
        "prohibition": true,
        "time_windows": [
          {
            "from": "08:00",
            "to": "16:00",
            "day_class": "named_weekday",
            "named_weekday": "thursday",
            "dates": {
              "mode": "only",
              "ranges": [
                {
                  "from": "11-01",
                  "to": "05-15"
                }
              ]
            }
          }
        ]
      },
      "index": 2
    },
    {
      "kind": "sign_plate",
      "lines": [],
      "background_color": "white",
      "legibility": {
        "readable": true
      },
      "parsed": {
        "arrow": "left",
        "pictogram": "arrow"
      },
      "index": 3
    }
  ],
  "panel_count": 3,
  "boundaries": {
    "certain": true
  }
}
